{
  "schema_version": "v1",
  "run_id": "2026-04-21T12-00-00Z__assigned__fixture",
  "rubric_scores": {
    "voice_match": null,
    "framing_quality": null,
    "originality": null,
    "macro_soundness": null,
    "evidence_usage": null,
    "conversational_quality": null,
    "sendability": null
  },
  "meets_publish_bar": false,
  "revision_notes": [],
  "summary": "Fixture: unevaluated rubric for schema tests."
}
